{
  "name": "x-social",
  "version": "0.1.0",
  "description": "Privacy social platform with ZK face verification, AI matchmaking, and privacy payments on OKX X Layer",
  "author": {
    "name": "erick-okkk",
    "email": "284951016+erick-okkk@users.noreply.github.com"
  },
  "homepage": "",
  "repository": "",
  "license": "See LICENSE",
  "keywords": ["okx", "hackathon"],
  "category": "development"
}
